{
  "_D": "urn:oasis:names:specification:ubl:schema:xsd:BusinessCard-2",
  "_A": "urn:oasis:names:specification:ubl:schema:xsd:CommonAggregateComponents-2",
  "_B": "urn:oasis:names:specification:ubl:schema:xsd:CommonBasicComponents-2",
  "BusinessCard": [
    {
      "UBLVersionID": [{ "_": "2.2" }],
      "ID": [{ "_": "BC1-2016" }],
      "IssueDate": [{ "_": "2016-11-07" }],
      "VersionID": [{ "_": "1.1" }],
      "PreviousVersionID": [{ "_": "1.0" }],
      "BriefDescription": [
        {
          "_": "OASIS is a nonprofit consortium that drives the development, convergence and adoption of open standards for the global information society.  OASIS promotes industry consensus and produces worldwide standards for security, Internet of Things, cloud computing, energy, content technologies, emergency management, and other areas. OASIS open standards offer the potential to lower cost, stimulate innovation, grow global markets, and protect the right of free choice of technology.  OASIS members broadly represent the marketplace of public and private sector technology leaders, users and influencers. The consortium has more than 5,000 participants representing over 600 organizations and individual members in more than 65 countries.  OASIS is distinguished by its transparent governance and operating procedures. Members themselves set the OASIS technical agenda, using a lightweight process expressly designed to promote industry consensus and unite disparate efforts. Completed work is ratified by open ballot. Governance is accountable and unrestricted. Officers of both the OASIS Board of Directors and Technical Advisory Board are chosen by democratic election to serve two-year terms. Consortium leadership is based on individual merit and is not tied to financial contribution, corporate standing, or special appointment.  OASIS Member Sections include AMQP, Emergency, IDtrust, LegalXML, Open CSA, OSLC, and WS-I."
        }
      ],
      "SenderParty": [
        {
          "WebsiteURI": [{ "_": "https://www.oasis-open.org" }],
          "LogoReferenceID": [
            {
              "_": "https://www.oasis-open.org/sites/www.oasis-open.org/files/logo.png"
            }
          ],
          "PartyName": [
            {
              "Name": [{ "_": "OASIS" }]
            },
            {
              "Name": [
                {
                  "_": "Organization for the Advancement of Structured Information Standards"
                }
              ]
            }
          ],
          "PostalAddress": [
            {
              "StreetName": [{ "_": "Corporate Drive Suite 150" }],
              "BuildingNumber": [{ "_": "35" }],
              "CityName": [{ "_": "Burlington" }],
              "PostalZone": [{ "_": "01803-4238" }],
              "CountrySubentityCode": [{ "_": "MA" }],
              "Country": [
                {
                  "IdentificationCode": [{ "_": "US" }]
                }
              ]
            }
          ],
          "PhysicalLocation": [
            {
              "InformationURI": [{ "_": "https://goo.gl/maps/2k242" }]
            }
          ],
          "Contact": [
            {
              "ID": [{ "_": "1" }],
              "Telephone": [{ "_": "+1 781 425 5073" }],
              "Telefax": [{ "_": "+1 781 425 5072" }],
              "ElectronicMail": [{ "_": "info@oasis-open.org" }]
            }
          ],
          "AdditionalWebSite": [
            {
              "ID": [{ "_": "1" }],
              "Name": [{ "_": "RSS" }],
              "URI": [{ "_": "https://www.oasis-open.org/feed" }]
            }
          ],
          "SocialMediaProfile": [
            {
              "ID": [{ "_": "1" }],
              "Name": [{ "_": "LinkedIN" }],
              "SocialMediaTypeCode": [{ "_": "Business" }],
              "URI": [{ "_": "https://www.linkedin.com/company/oasis" }]
            },
            {
              "ID": [{ "_": "2" }],
              "Name": [{ "_": "Twitter" }],
              "URI": [{ "_": "http://twitter.com/OASISopen" }]
            },
            {
              "ID": [{ "_": "3" }],
              "Name": [{ "_": "Facebook" }],
              "URI": [{ "_": "http://facebook.com/oasis.open" }]
            },
            {
              "ID": [{ "_": "4" }],
              "Name": [{ "_": "YouTube" }],
              "URI": [{ "_": "http://www.youtube.com/oasisopen" }]
            },
            {
              "ID": [{ "_": "5" }],
              "Name": [{ "_": "Google+" }],
              "URI": [{ "_": "https://plus.google.com/+Oasis-openOrg" }]
            }
          ]
        }
      ],
      "BusinessParty": [
        {
          "EndpointID": [
            { "_": "9994567987654", "schemeID": "GLN", "schemeAgencyID": "9" }
          ],
          "PartyIdentification": [
            {
              "ID": [{ "_": "GB999999973", "schemeID": "GB:VAT" }]
            }
          ],
          "PartyName": [
            {
              "Name": [{ "_": "World Events Ltd." }]
            }
          ],
          "PostalAddress": [
            {
              "CityName": [{ "_": "London" }],
              "Country": [
                {
                  "IdentificationCode": [{ "_": "GB" }]
                }
              ]
            }
          ]
        }
      ],
      "BusinessCapability": [
        {
          "CapabilityTypeCode": [{ "_": "General" }],
          "Description": [
            { "_": "Advancing open standards for the information society." }
          ]
        }
      ]
    }
  ]
}
